{"artifact":{"chart":"gatekeeper","repository":"gatekeeper","type":"helm","version":"3.23.0","versions":[{"appVersion":"v3.23.0","artifact":{"digest":"sha256:33f018bca8b875a9e01f447efef09414609d0d38185101207a4a6d655fe3d2a0","name":"gatekeeper","repository":"gatekeeper","type":"helm-http","version":"3.23.0"},"available":true,"compatibility":{"kubernetes":">=1.31.0 <1.36.0"},"configuration":{"defaultPreset":"upstream","namespace":"astronomer-gatekeeper-system","presets":[{"description":"Start with the exact chart defaults; configure storage, exposure and secret references for your cluster.","id":"upstream","label":"Upstream defaults","values":{}}],"schema":{"properties":{"auditInterval":{"default":60,"title":"Audit interval","type":"integer"},"constraintViolationsLimit":{"default":20,"title":"Violations retained per constraint","type":"integer"},"controllerManager":{"properties":{"resources":{"properties":{"limits":{"properties":{"cpu":{"pattern":"^([0-9]+(\\.[0-9]+)?([EPTGMK]i?|m)?|)$","title":"CPU limit","type":"string"},"memory":{"pattern":"^([0-9]+(\\.[0-9]+)?([EPTGMK]i?|m)?|)$","title":"Memory limit","type":"string"}},"title":"Limits","type":"object"},"requests":{"properties":{"cpu":{"pattern":"^([0-9]+(\\.[0-9]+)?([EPTGMK]i?|m)?|)$","title":"CPU request","type":"string"},"memory":{"pattern":"^([0-9]+(\\.[0-9]+)?([EPTGMK]i?|m)?|)$","title":"Memory request","type":"string"}},"title":"Requests","type":"object"}},"title":"Controller resources","type":"object"}},"type":"object"},"enableExternalData":{"default":true,"title":"Enable external data","type":"boolean"},"replicas":{"default":3,"minimum":0,"title":"Controller replicas","type":"integer"}},"type":"object"}},"identities":{"chartDigest":"sha256:33f018bca8b875a9e01f447efef09414609d0d38185101207a4a6d655fe3d2a0"},"recommended":true,"supportTier":"upstream","version":"3.23.0"}]},"category":"security","compatibility":{"kubernetes":">=1.31.0 <1.36.0"},"defaultEnabled":false,"description":"Enforce reusable constraints on Kubernetes resources and report policy violations.","documentation":"https://open-policy-agent.github.io/gatekeeper/website/docs/install/","home":"https://open-policy-agent.github.io/gatekeeper/website/","icon":"https://cdn.simpleicons.org/openpolicyagent/7D9199","keywords":["opa","policy","admission","compliance"],"lifecycle":{"install":true,"rollback":true,"uninstall":true,"upgrade":true},"name":"OPA Gatekeeper","privileged":true,"resources":{"profile":"medium"},"slug":"gatekeeper","storage":{"required":false},"summary":"Admission control and policy enforcement powered by Open Policy Agent.","supportTier":"upstream","ui":{"configurationMode":"schema-and-yaml","featured":true,"sections":["admission","audit","mutation","resources"]}}
