{"artifact":{"chart":"velero","repository":"vmware-tanzu","type":"helm","version":"12.1.0","versions":[{"appVersion":"1.18.1","artifact":{"digest":"sha256:cd23589ad1b2d25cdd3220f6866b3f6f4c5683c4c09494e76a14700b33f81f83","name":"velero","repository":"vmware-tanzu","type":"helm-http","version":"12.1.0"},"available":true,"compatibility":{"kubernetes":">=1.31.0 <1.36.0"},"configuration":{"defaultPreset":"upstream","namespace":"velero","presets":[{"description":"Start with the exact chart defaults; configure storage, exposure and secret references for your cluster.","id":"upstream","label":"Upstream defaults","values":{}}],"schema":{"properties":{"backupsEnabled":{"default":true,"description":"Requires at least one backup storage location. Disable this and snapshots to run an explicit node-agent-only deployment.","title":"Enable backups","type":"boolean"},"configuration":{"properties":{"backupStorageLocation":{"default":[{"accessMode":"ReadWrite","annotations":{},"backupSyncPeriod":null,"bucket":"","caCert":null,"config":{},"credential":{"key":null,"name":null},"default":false,"name":null,"prefix":null,"provider":"","validationFrequency":null}],"items":{"properties":{"accessMode":{"default":"ReadWrite","type":"string"},"annotations":{"properties":{},"type":"object"},"backupSyncPeriod":{"default":null,"type":["string","null"]},"bucket":{"default":"","type":"string"},"caCert":{"default":null,"type":["string","null"]},"config":{"properties":{},"type":"object"},"credential":{"properties":{"key":{"default":null,"type":["string","null"]},"name":{"default":null,"type":["string","null"]}},"type":"object"},"default":{"default":false,"type":"boolean"},"name":{"default":null,"type":["string","null"]},"prefix":{"default":null,"type":["string","null"]},"provider":{"default":"","type":"string"},"validationFrequency":{"default":null,"type":["string","null"]}},"type":"object"},"title":"Backup storage locations","type":"array"},"volumeSnapshotLocation":{"default":[{"annotations":{},"config":{},"credential":{"key":null,"name":null},"name":null,"provider":""}],"items":{"properties":{"annotations":{"properties":{},"type":"object"},"config":{"properties":{},"type":"object"},"credential":{"properties":{"key":{"default":null,"type":["string","null"]},"name":{"default":null,"type":["string","null"]}},"type":"object"},"name":{"default":null,"type":["string","null"]},"provider":{"default":"","type":"string"}},"type":"object"},"title":"Snapshot locations","type":"array"}},"type":"object"},"credentials":{"properties":{"existingSecret":{"default":null,"title":"Credential Secret","type":["string","null"]}},"type":"object"},"deployNodeAgent":{"default":false,"description":"Runs filesystem data-movement agents on cluster nodes, including in node-agent-only deployments.","title":"Deploy node agent","type":"boolean"},"metrics":{"properties":{"serviceMonitor":{"properties":{"enabled":{"default":false,"title":"Create ServiceMonitor","type":"boolean"}},"type":"object"}},"type":"object"},"resources":{"properties":{"limits":{"properties":{"cpu":{"pattern":"^([0-9]+(\\.[0-9]+)?([EPTGMK]i?|m)?|)$","title":"CPU limit","type":"string"},"memory":{"pattern":"^([0-9]+(\\.[0-9]+)?([EPTGMK]i?|m)?|)$","title":"Memory limit","type":"string"}},"title":"Limits","type":"object"},"requests":{"properties":{"cpu":{"pattern":"^([0-9]+(\\.[0-9]+)?([EPTGMK]i?|m)?|)$","title":"CPU request","type":"string"},"memory":{"pattern":"^([0-9]+(\\.[0-9]+)?([EPTGMK]i?|m)?|)$","title":"Memory request","type":"string"}},"title":"Requests","type":"object"}},"title":"Server resources","type":"object"},"snapshotsEnabled":{"default":true,"title":"Enable snapshots","type":"boolean"}},"type":"object"}},"identities":{"chartDigest":"sha256:cd23589ad1b2d25cdd3220f6866b3f6f4c5683c4c09494e76a14700b33f81f83"},"recommended":true,"supportTier":"upstream","version":"12.1.0"}]},"category":"storage","compatibility":{"kubernetes":">=1.31.0 <1.36.0"},"defaultEnabled":false,"description":"Protect cluster resources and application data using object storage and supported volume snapshot providers.","documentation":"https://velero.io/docs/","home":"https://velero.io/","icon":"https://raw.githubusercontent.com/vmware-tanzu/velero/main/site/static/img/Velero.svg","keywords":["backup","restore","disaster-recovery","snapshots"],"lifecycle":{"install":true,"rollback":true,"uninstall":true,"upgrade":true},"name":"Velero","privileged":true,"resources":{"profile":"medium"},"slug":"velero","storage":{"externalObjectStorage":true,"required":false},"summary":"Backup and restore Kubernetes resources and persistent volumes.","supportTier":"upstream","ui":{"configurationMode":"schema-and-yaml","featured":true,"sections":["object-storage","snapshots","schedules","credentials","resources"]}}
