{"artifact":{"chart":"ingress-nginx","repository":"ingress-nginx","type":"helm","version":"4.15.1","versions":[{"appVersion":"1.15.1","artifact":{"digest":"sha256:3eff0bd18151d6e6b1c441463410571443dda1ac78292cb189346628de784f0c","name":"ingress-nginx","repository":"ingress-nginx","type":"helm-http","version":"4.15.1"},"available":true,"compatibility":{"kubernetes":">=1.31.0 <1.36.0"},"configuration":{"defaultPreset":"upstream","namespace":"astronomer-ingress-nginx","presets":[{"description":"Start with the exact chart defaults; configure storage, exposure and secret references for your cluster.","id":"upstream","label":"Upstream defaults","values":{}}],"schema":{"properties":{"controller":{"properties":{"autoscaling":{"properties":{"annotations":{"properties":{},"type":"object"},"behavior":{"properties":{},"type":"object"},"enabled":{"default":false,"type":"boolean"},"maxReplicas":{"default":11,"type":"integer"},"minReplicas":{"default":1,"type":"integer"},"targetCPUUtilizationPercentage":{"default":50,"type":"integer"},"targetMemoryUtilizationPercentage":{"default":50,"type":"integer"}},"title":"Autoscaling","type":"object"},"hostPort":{"properties":{"enabled":{"default":false,"title":"Bind host ports","type":"boolean"}},"type":"object"},"ingressClassResource":{"properties":{"aliases":{"default":[],"items":{"type":"string"},"type":"array"},"annotations":{"properties":{},"type":"object"},"controllerValue":{"default":"k8s.io/ingress-nginx","type":"string"},"default":{"default":false,"type":"boolean"},"enabled":{"default":true,"type":"boolean"},"name":{"default":"nginx","type":"string"},"parameters":{"properties":{},"type":"object"}},"title":"IngressClass","type":"object"},"metrics":{"properties":{"enabled":{"default":false,"title":"Expose metrics","type":"boolean"}},"type":"object"},"replicaCount":{"default":1,"minimum":0,"title":"Controller replicas","type":"integer"},"resources":{"properties":{"limits":{"properties":{"cpu":{"pattern":"^([0-9]+(\\.[0-9]+)?([EPTGMK]i?|m)?|)$","title":"CPU limit","type":"string"},"memory":{"pattern":"^([0-9]+(\\.[0-9]+)?([EPTGMK]i?|m)?|)$","title":"Memory limit","type":"string"}},"title":"Limits","type":"object"},"requests":{"properties":{"cpu":{"pattern":"^([0-9]+(\\.[0-9]+)?([EPTGMK]i?|m)?|)$","title":"CPU request","type":"string"},"memory":{"pattern":"^([0-9]+(\\.[0-9]+)?([EPTGMK]i?|m)?|)$","title":"Memory request","type":"string"}},"title":"Requests","type":"object"}},"title":"Controller resources","type":"object"},"service":{"properties":{"externalTrafficPolicy":{"default":"","title":"External traffic policy","type":"string"},"type":{"default":"LoadBalancer","title":"Service type","type":"string"}},"type":"object"}},"type":"object"}},"type":"object"}},"identities":{"chartDigest":"sha256:3eff0bd18151d6e6b1c441463410571443dda1ac78292cb189346628de784f0c"},"recommended":true,"supportTier":"upstream","version":"4.15.1"}]},"category":"networking","compatibility":{"kubernetes":">=1.31.0 <1.36.0"},"defaultEnabled":false,"documentation":"https://kubernetes.github.io/ingress-nginx/deploy/","home":"https://kubernetes.github.io/ingress-nginx/","icon":"https://cdn.simpleicons.org/nginx/009639","keywords":["ingress","nginx","load-balancer"],"lifecycle":{"install":true,"rollback":true,"uninstall":true,"upgrade":true},"name":"Ingress NGINX","privileged":true,"resources":{"profile":"medium"},"slug":"ingress-nginx","storage":{"required":false},"summary":"NGINX-based Kubernetes ingress controller.","supportTier":"upstream","ui":{"configurationMode":"schema-and-yaml","featured":true,"sections":["controller","service","tls","autoscaling","resources"]}}
