{"artifact":{"chart":"keda","repository":"kedacore","type":"helm","version":"2.20.2","versions":[{"appVersion":"2.20.2","artifact":{"digest":"sha256:db60b1fa60f0565fefa4ce2f87e855b6a8854363ee82962fbe28a12a70d64c4c","name":"keda","repository":"kedacore","type":"helm-http","version":"2.20.2"},"available":true,"compatibility":{"kubernetes":">=1.31.0 <1.36.0"},"configuration":{"defaultPreset":"upstream","namespace":"astronomer-keda","presets":[{"description":"Start with the exact chart defaults; configure storage, exposure and secret references for your cluster.","id":"upstream","label":"Upstream defaults","values":{}}],"schema":{"properties":{"crds":{"properties":{"install":{"default":true,"title":"Install CRDs","type":"boolean"}},"type":"object"},"metricsServer":{"properties":{"replicaCount":{"default":1,"minimum":0,"title":"Metrics server replicas","type":"integer"}},"type":"object"},"operator":{"properties":{"replicaCount":{"default":1,"minimum":0,"title":"Operator replicas","type":"integer"}},"type":"object"},"prometheus":{"properties":{"operator":{"properties":{"enabled":{"default":false,"title":"Operator metrics","type":"boolean"}},"type":"object"}},"type":"object"},"resources":{"properties":{"limits":{"properties":{"cpu":{"pattern":"^([0-9]+(\\.[0-9]+)?([EPTGMK]i?|m)?|)$","title":"CPU limit","type":"string"},"memory":{"pattern":"^([0-9]+(\\.[0-9]+)?([EPTGMK]i?|m)?|)$","title":"Memory limit","type":"string"}},"title":"Limits","type":"object"},"requests":{"properties":{"cpu":{"pattern":"^([0-9]+(\\.[0-9]+)?([EPTGMK]i?|m)?|)$","title":"CPU request","type":"string"},"memory":{"pattern":"^([0-9]+(\\.[0-9]+)?([EPTGMK]i?|m)?|)$","title":"Memory request","type":"string"}},"title":"Requests","type":"object"}},"title":"Operator resources","type":"object"},"webhooks":{"properties":{"replicaCount":{"default":1,"minimum":0,"title":"Webhook replicas","type":"integer"}},"type":"object"}},"type":"object"}},"identities":{"chartDigest":"sha256:db60b1fa60f0565fefa4ce2f87e855b6a8854363ee82962fbe28a12a70d64c4c"},"recommended":true,"supportTier":"upstream","version":"2.20.2"}]},"category":"other","compatibility":{"kubernetes":">=1.31.0 <1.36.0"},"defaultEnabled":false,"description":"Scale Deployments, Jobs, and custom workloads from external event and queue metrics.","documentation":"https://keda.sh/docs/deploy/","home":"https://keda.sh/","icon":"https://raw.githubusercontent.com/kedacore/keda/main/images/keda-logo-transparent.png","keywords":["autoscaling","events","queues","hpa"],"lifecycle":{"install":true,"rollback":true,"uninstall":true,"upgrade":true},"name":"KEDA","privileged":true,"resources":{"profile":"medium"},"slug":"keda","storage":{"required":false},"summary":"Event-driven autoscaling for Kubernetes workloads.","supportTier":"upstream","ui":{"configurationMode":"schema-and-yaml","featured":true,"sections":["operator","metrics-server","webhooks","resources"]}}
