{"artifact":{"chart":"fluent-bit","repository":"fluent","type":"helm","version":"0.58.1","versions":[{"appVersion":"5.1.1","artifact":{"digest":"sha256:fc2235278cdb4e76befb8520464a66ff459c6d7711bbbc8755dedcc32799877b","name":"fluent-bit","repository":"fluent","type":"helm-http","version":"0.58.1"},"available":true,"compatibility":{"kubernetes":">=1.31.0 <1.36.0"},"configuration":{"defaultPreset":"upstream","namespace":"astronomer-logging","presets":[{"description":"Start with the exact chart defaults; configure storage, exposure and secret references for your cluster.","id":"upstream","label":"Upstream defaults","values":{}}],"schema":{"properties":{"config":{"properties":{"filters":{"default":"[FILTER]\n    Name kubernetes\n    Match kube.*\n    Merge_Log On\n    Keep_Log Off\n    K8S-Logging.Parser On\n    K8S-Logging.Exclude On\n","title":"Filters","type":"string"},"inputs":{"default":"[INPUT]\n    Name tail\n    Path /var/log/containers/*.log\n    multiline.parser docker, cri\n    Tag kube.*\n    Mem_Buf_Limit 5MB\n    Skip_Long_Lines On\n\n[INPUT]\n    Name systemd\n    Tag host.*\n    Systemd_Filter _SYSTEMD_UNIT=kubelet.service\n    Read_From_Tail On\n","title":"Inputs","type":"string"},"outputs":{"default":"[OUTPUT]\n    Name es\n    Match kube.*\n    Host elasticsearch-master\n    Logstash_Format On\n    Retry_Limit False\n\n[OUTPUT]\n    Name es\n    Match host.*\n    Host elasticsearch-master\n    Logstash_Format On\n    Logstash_Prefix node\n    Retry_Limit False\n","title":"Outputs","type":"string"}},"type":"object"},"flush":{"default":1,"title":"Flush interval","type":"integer"},"kind":{"default":"DaemonSet","title":"Workload type","type":"string"},"logLevel":{"default":"info","title":"Log level","type":"string"},"replicaCount":{"default":1,"minimum":0,"title":"Deployment replicas","type":"integer"},"resources":{"properties":{"limits":{"properties":{"cpu":{"pattern":"^([0-9]+(\\.[0-9]+)?([EPTGMK]i?|m)?|)$","title":"CPU limit","type":"string"},"memory":{"pattern":"^([0-9]+(\\.[0-9]+)?([EPTGMK]i?|m)?|)$","title":"Memory limit","type":"string"}},"title":"Limits","type":"object"},"requests":{"properties":{"cpu":{"pattern":"^([0-9]+(\\.[0-9]+)?([EPTGMK]i?|m)?|)$","title":"CPU request","type":"string"},"memory":{"pattern":"^([0-9]+(\\.[0-9]+)?([EPTGMK]i?|m)?|)$","title":"Memory request","type":"string"}},"title":"Requests","type":"object"}},"title":"Resources","type":"object"},"serviceMonitor":{"properties":{"enabled":{"default":false,"title":"Create ServiceMonitor","type":"boolean"}},"type":"object"}},"type":"object"}},"identities":{"chartDigest":"sha256:fc2235278cdb4e76befb8520464a66ff459c6d7711bbbc8755dedcc32799877b"},"recommended":true,"supportTier":"upstream","version":"0.58.1"}]},"category":"logging","compatibility":{"kubernetes":">=1.31.0 <1.36.0"},"defaultEnabled":false,"description":"Collect, enrich, and route node and container logs to supported logging backends.","documentation":"https://docs.fluentbit.io/manual/installation/kubernetes","home":"https://fluentbit.io/","icon":"https://cdn.simpleicons.org/fluentbit/49BDA5","keywords":["logs","forwarder","daemonset","observability"],"lifecycle":{"install":true,"rollback":true,"uninstall":true,"upgrade":true},"name":"Fluent Bit","privileged":true,"resources":{"profile":"small"},"slug":"fluent-bit","storage":{"required":false},"summary":"Lightweight Kubernetes log processor and forwarder.","supportTier":"upstream","ui":{"configurationMode":"schema-and-yaml","featured":true,"sections":["inputs","filters","outputs","buffers","resources"]}}
