{"artifact":{"chart":"constellation","repository":"astronomer-first-party","type":"helm","version":"0.2.0","versions":[{"appVersion":"0.2.0","artifact":{"digest":"sha256:ea0d90ca7a7f7bb6d2ffaa466f925b96d2cae5b3d95728603d17ece12d72ee46","name":"constellation","repository":"astronomer-first-party","type":"helm-http","version":"0.2.0"},"available":true,"compatibility":{"kubernetes":">=1.27.0 <1.36.0"},"configuration":{"defaultPreset":"upstream","namespace":"astronomer-constellation","presets":[{"description":"Start with the exact chart defaults; configure storage, exposure and secret references for your cluster.","id":"upstream","label":"Upstream defaults","values":{}}],"schema":{"properties":{"admission":{"properties":{"enabled":{"default":true,"title":"Enable admission controller","type":"boolean"},"replicas":{"default":2,"minimum":0,"title":"Admission replicas","type":"integer"},"webhook":{"properties":{"enabled":{"default":true,"title":"Enable admission webhook","type":"boolean"},"failurePolicy":{"default":"Ignore","title":"Webhook failure policy","type":"string"},"timeoutSeconds":{"default":5,"title":"Webhook timeout","type":"integer"}},"type":"object"}},"type":"object"},"api":{"properties":{"replicas":{"default":2,"minimum":0,"title":"API replicas","type":"integer"}},"type":"object"},"frontend":{"properties":{"replicas":{"default":2,"minimum":0,"title":"Web console replicas","type":"integer"}},"type":"object"},"highAvailability":{"properties":{"enabled":{"default":false,"title":"Enable high availability","type":"boolean"},"topologyKey":{"default":"kubernetes.io/hostname","title":"Topology key","type":"string"},"whenUnsatisfiable":{"default":"DoNotSchedule","title":"Scheduling policy","type":"string"}},"type":"object"},"image":{"properties":{"tag":{"default":"","description":"Release tag used for every Constellation component unless a role overrides it.","title":"Image tag","type":"string"}},"type":"object"},"ingress":{"properties":{"className":{"default":"","title":"Ingress class","type":"string"},"enabled":{"default":false,"title":"Enable Ingress","type":"boolean"},"host":{"default":"constellation.example.com","title":"Ingress host","type":"string"},"tls":{"properties":{"enabled":{"default":false,"title":"Enable Ingress TLS","type":"boolean"},"secretName":{"default":"constellation-frontend-tls","title":"Ingress TLS Secret","type":"string"}},"type":"object"}},"type":"object"},"networkPolicies":{"properties":{"enabled":{"default":false,"title":"Enable network policies","type":"boolean"}},"type":"object"},"postgres":{"properties":{"cloudnativepg":{"properties":{"enabled":{"default":false,"title":"Use CloudNativePG","type":"boolean"},"instances":{"default":3,"title":"CloudNativePG instances","type":"integer"},"storage":{"default":"20Gi","pattern":"^([0-9]+(\\.[0-9]+)?([EPTGMK]i?|m)?|)$","title":"CloudNativePG storage","type":"string"}},"type":"object"},"embeddedConfig":{"properties":{"storage":{"default":"20Gi","pattern":"^([0-9]+(\\.[0-9]+)?([EPTGMK]i?|m)?|)$","title":"Embedded database storage","type":"string"},"storageClass":{"default":"","title":"Database StorageClass","type":"string","x-astronomer-resource":"storageclasses"}},"type":"object"},"existingSecret":{"default":"","title":"Existing PostgreSQL Secret","type":"string","x-astronomer-resource":"secrets"},"mode":{"default":"","title":"PostgreSQL mode","type":"string"}},"type":"object"},"runtimeAgent":{"properties":{"enabled":{"default":true,"title":"Enable runtime agent","type":"boolean"},"enforcement":{"properties":{"dpi":{"default":false,"title":"Enable deep packet inspection","type":"boolean"},"mode":{"default":"monitor","title":"Runtime enforcement mode","type":"string"},"network":{"default":false,"title":"Enforce network activity","type":"boolean"}},"type":"object"}},"type":"object"},"scanner":{"properties":{"cache":{"properties":{"persistent":{"default":true,"title":"Persist scanner cache","type":"boolean"},"size":{"default":"8Gi","title":"Scanner cache size","type":"string"},"storageClass":{"default":"","title":"Scanner cache StorageClass","type":"string","x-astronomer-resource":"storageclasses"}},"type":"object"},"enabled":{"default":true,"title":"Enable scanner","type":"boolean"},"engines":{"properties":{"grype":{"default":true,"title":"Enable Grype","type":"boolean"},"syft":{"default":true,"title":"Enable Syft","type":"boolean"},"trivy":{"default":true,"title":"Enable Trivy","type":"boolean"}},"type":"object"},"maxConcurrent":{"default":1,"title":"Concurrent scans per replica","type":"integer"},"replicas":{"default":2,"minimum":0,"title":"Scanner replicas","type":"integer"}},"type":"object"},"tls":{"properties":{"certManager":{"properties":{"enabled":{"default":false,"title":"Use cert-manager for admission TLS","type":"boolean"},"issuer":{"default":"","title":"Certificate issuer","type":"string"},"issuerKind":{"default":"ClusterIssuer","title":"Certificate issuer kind","type":"string"}},"type":"object"}},"type":"object"}},"type":"object"}},"identities":{"chartDigest":"sha256:ea0d90ca7a7f7bb6d2ffaa466f925b96d2cae5b3d95728603d17ece12d72ee46"},"recommended":true,"supportTier":"experimental","version":"0.2.0"}]},"category":"security","compatibility":{"kubernetes":">=1.27.0 <1.36.0"},"defaultEnabled":false,"description":"Discover workloads, analyze images with Trivy and Grype, generate SBOM inventory with Syft, visualize network flows, enforce admission and runtime policy, and operate compliance programs from one highly available control plane.","documentation":"https://github.com/alphabravo-oss/constellation/tree/main/docs","home":"https://github.com/alphabravo-oss/constellation","icon":"https://raw.githubusercontent.com/alphabravo-oss/constellation/main/frontend/public/icon.svg","keywords":["security","runtime","admission","trivy","grype","syft","sbom","compliance","network"],"lifecycle":{"install":true,"rollback":true,"uninstall":true,"upgrade":true},"name":"Constellation","privileged":true,"resources":{"notes":"Runtime agents run on every node; scanners and PostgreSQL should be sized for image volume and retention.","profile":"large"},"slug":"constellation","storage":{"recommended":"20Gi database plus 8Gi scanner cache","required":true,"thinProvisioning":true},"summary":"Astronomer first-party Kubernetes and container security platform.","supportTier":"experimental","ui":{"configurationMode":"schema-and-yaml","featured":true,"sections":["high-availability","scanning","runtime","admission","ingress","postgres","tls","bootstrap"]}}
