{"artifact":{"chart":"opentelemetry-collector","repository":"open-telemetry","type":"helm","version":"0.171.0","versions":[{"appVersion":"0.158.0","artifact":{"digest":"sha256:5526010c00b6319ced10dd9e711149b10d5539dfa1e23ee22546648f7f702352","name":"opentelemetry-collector","repository":"open-telemetry","type":"helm-http","version":"0.171.0"},"available":true,"compatibility":{"kubernetes":">=1.31.0 <1.36.0"},"configuration":{"defaultPreset":"deployment","namespace":"astronomer-opentelemetry","presets":[{"description":"Contrib collector running as a Deployment. Configure your receivers and exporter destinations before production use.","id":"deployment","label":"Collector deployment","values":{"command":{"name":"otelcol-contrib"},"image":{"repository":"otel/opentelemetry-collector-contrib"},"mode":"deployment"}}],"schema":{"properties":{"config":{"properties":{"exporters":{"properties":{"debug":{"properties":{},"type":"object"}},"title":"Exporters","type":"object"},"processors":{"properties":{"batch":{"properties":{},"type":"object"},"memory_limiter":{"properties":{"check_interval":{"default":"5s","type":"string"},"limit_percentage":{"default":80,"type":"integer"},"spike_limit_percentage":{"default":25,"type":"integer"}},"type":"object"}},"title":"Processors","type":"object"},"receivers":{"properties":{"jaeger":{"properties":{"protocols":{"properties":{"grpc":{"properties":{"endpoint":{"default":"${env:MY_POD_IP}:14250","type":"string"}},"type":"object"},"thrift_compact":{"properties":{"endpoint":{"default":"${env:MY_POD_IP}:6831","type":"string"}},"type":"object"},"thrift_http":{"properties":{"endpoint":{"default":"${env:MY_POD_IP}:14268","type":"string"}},"type":"object"}},"type":"object"}},"type":"object"},"otlp":{"properties":{"protocols":{"properties":{"grpc":{"properties":{"endpoint":{"default":"${env:MY_POD_IP}:4317","type":"string"}},"type":"object"},"http":{"properties":{"endpoint":{"default":"${env:MY_POD_IP}:4318","type":"string"}},"type":"object"}},"type":"object"}},"type":"object"},"prometheus":{"properties":{"config":{"properties":{"scrape_configs":{"default":[{"job_name":"opentelemetry-collector","scrape_interval":"10s","static_configs":[{"targets":["${env:MY_POD_IP}:8888"]}]}],"items":{"properties":{"job_name":{"default":"opentelemetry-collector","type":"string"},"scrape_interval":{"default":"10s","type":"string"},"static_configs":{"default":[{"targets":["${env:MY_POD_IP}:8888"]}],"items":{"properties":{"targets":{"default":["${env:MY_POD_IP}:8888"],"items":{"default":"${env:MY_POD_IP}:8888","type":"string"},"type":"array"}},"type":"object"},"type":"array"}},"type":"object"},"type":"array"}},"type":"object"}},"type":"object"},"zipkin":{"properties":{"endpoint":{"default":"${env:MY_POD_IP}:9411","type":"string"}},"type":"object"}},"title":"Receivers","type":"object"},"service":{"properties":{"pipelines":{"properties":{"logs":{"properties":{"exporters":{"default":["debug"],"items":{"default":"debug","type":"string"},"type":"array"},"processors":{"default":["memory_limiter","batch"],"items":{"default":"memory_limiter","type":"string"},"type":"array"},"receivers":{"default":["otlp"],"items":{"default":"otlp","type":"string"},"type":"array"}},"type":"object"},"metrics":{"properties":{"exporters":{"default":["debug"],"items":{"default":"debug","type":"string"},"type":"array"},"processors":{"default":["memory_limiter","batch"],"items":{"default":"memory_limiter","type":"string"},"type":"array"},"receivers":{"default":["otlp","prometheus"],"items":{"default":"otlp","type":"string"},"type":"array"}},"type":"object"},"traces":{"properties":{"exporters":{"default":["debug"],"items":{"default":"debug","type":"string"},"type":"array"},"processors":{"default":["memory_limiter","batch"],"items":{"default":"memory_limiter","type":"string"},"type":"array"},"receivers":{"default":["otlp","jaeger","zipkin"],"items":{"default":"otlp","type":"string"},"type":"array"}},"type":"object"}},"title":"Pipelines","type":"object"}},"type":"object"}},"type":"object"},"image":{"properties":{"repository":{"description":"Required by this chart. Choose the core or contrib collector image that provides the components used by the pipeline.","minLength":1,"title":"Collector image repository","type":"string"}},"type":"object"},"mode":{"enum":["daemonset","deployment","statefulset"],"title":"Deployment mode","type":"string"},"ports":{"properties":{"metrics":{"properties":{"enabled":{"default":false,"description":"Publishes the collector's internal telemetry so accepted and rejected data can be verified.","title":"Expose collector metrics","type":"boolean"},"servicePort":{"default":8888,"title":"Collector metrics port","type":"integer"}},"type":"object"}},"type":"object"},"replicaCount":{"default":1,"minimum":0,"title":"Replicas","type":"integer"},"resources":{"properties":{"limits":{"properties":{"cpu":{"pattern":"^([0-9]+(\\.[0-9]+)?([EPTGMK]i?|m)?|)$","title":"CPU limit","type":"string"},"memory":{"pattern":"^([0-9]+(\\.[0-9]+)?([EPTGMK]i?|m)?|)$","title":"Memory limit","type":"string"}},"title":"Limits","type":"object"},"requests":{"properties":{"cpu":{"pattern":"^([0-9]+(\\.[0-9]+)?([EPTGMK]i?|m)?|)$","title":"CPU request","type":"string"},"memory":{"pattern":"^([0-9]+(\\.[0-9]+)?([EPTGMK]i?|m)?|)$","title":"Memory request","type":"string"}},"title":"Requests","type":"object"}},"title":"Resources","type":"object"},"serviceMonitor":{"properties":{"enabled":{"default":false,"title":"Create ServiceMonitor","type":"boolean"}},"type":"object"}},"type":"object"}},"identities":{"chartDigest":"sha256:5526010c00b6319ced10dd9e711149b10d5539dfa1e23ee22546648f7f702352"},"recommended":true,"supportTier":"upstream","version":"0.171.0"}]},"category":"monitoring","compatibility":{"kubernetes":">=1.31.0 <1.36.0"},"defaultEnabled":false,"description":"Receive, process, and export metrics, logs, and traces through configurable OpenTelemetry pipelines.","documentation":"https://opentelemetry.io/docs/platforms/kubernetes/helm/collector/","home":"https://opentelemetry.io/docs/collector/","icon":"https://cdn.simpleicons.org/opentelemetry/000000","keywords":["opentelemetry","otel","metrics","logs","traces"],"lifecycle":{"install":true,"rollback":true,"uninstall":true,"upgrade":true},"name":"OpenTelemetry Collector","privileged":false,"resources":{"profile":"medium"},"slug":"opentelemetry-collector","storage":{"required":false},"summary":"Vendor-neutral collection and routing for telemetry data.","supportTier":"upstream","ui":{"configurationMode":"schema-and-yaml","featured":true,"sections":["mode","receivers","processors","exporters","resources"]}}
