{"artifact":{"chart":"longhorn","repository":"longhorn","type":"helm","version":"1.12.1","versions":[{"appVersion":"v1.12.1","artifact":{"digest":"sha256:c8cf4b35a9d872cd5f7e44fd26d8e6ac7c2abaee42f4e2f2a0b0ebbc6e3a6116","name":"longhorn","repository":"longhorn","type":"helm-http","version":"1.12.1"},"available":true,"compatibility":{"kubernetes":">=1.31.0 <1.36.0"},"configuration":{"defaultPreset":"replicated","namespace":"longhorn-system","presets":[{"description":"Requires at least three eligible prepared nodes. Keeps existing default StorageClasses and retains released volumes. Review disk capacity and host prerequisites.","id":"replicated","label":"Three-replica storage","values":{"persistence":{"defaultClass":false,"defaultClassReplicaCount":3,"reclaimPolicy":"Retain"}}},{"description":"One volume replica provides no node-failure redundancy. Keeps existing default StorageClasses and retains released volumes.","id":"evaluation","label":"Single-node evaluation","values":{"persistence":{"defaultClass":false,"defaultClassReplicaCount":1,"reclaimPolicy":"Retain"}}}],"schema":{"properties":{"defaultSettings":{"properties":{"defaultDataPath":{"default":null,"description":"Dedicated host data path. Nodes must satisfy Longhorn host prerequisites; changing this field does not prepare their disks.","title":"Default data path","type":["string","null"]}},"type":"object"},"ingress":{"properties":{"enabled":{"default":false,"title":"Enable Ingress","type":"boolean"},"host":{"default":"sslip.io","title":"Ingress host","type":"string"}},"type":"object"},"longhornUI":{"properties":{"replicas":{"default":2,"minimum":1,"title":"UI replicas","type":"integer"}},"type":"object"},"metrics":{"properties":{"serviceMonitor":{"properties":{"enabled":{"default":false,"title":"Create ServiceMonitor","type":"boolean"}},"type":"object"}},"type":"object"},"persistence":{"properties":{"defaultClass":{"default":true,"title":"Default StorageClass","type":"boolean"},"defaultClassReplicaCount":{"default":3,"maximum":20,"minimum":1,"title":"Replicas per volume","type":"integer"},"reclaimPolicy":{"default":"Delete","enum":["Delete","Retain"],"title":"Reclaim policy","type":"string"}},"type":"object"}},"type":"object"}},"identities":{"chartDigest":"sha256:c8cf4b35a9d872cd5f7e44fd26d8e6ac7c2abaee42f4e2f2a0b0ebbc6e3a6116"},"recommended":true,"releaseNotes":"Archive verified against the upstream release asset, Helm index and release source commit. Community support; no Astronomer live assurance. See docs/evidence/035/longhorn-review.json.","supportTier":"upstream","version":"1.12.1"}]},"category":"storage","compatibility":{"kubernetes":">=1.31.0 <1.36.0"},"defaultEnabled":false,"description":"Replicated persistent volumes, snapshots, backups, disaster recovery, and a storage management UI.","documentation":"https://longhorn.io/docs/","home":"https://longhorn.io/","icon":"https://raw.githubusercontent.com/longhorn/website/master/static/img/logos/longhorn-icon-color.svg","keywords":["csi","storage","volumes","replication","backup"],"lifecycle":{"install":true,"rollback":false,"uninstall":true,"upgrade":true},"name":"Longhorn","privileged":true,"resources":{"profile":"large"},"slug":"longhorn","storage":{"hostStorage":true,"required":true},"summary":"Cloud-native distributed block storage for Kubernetes.","supportTier":"upstream","ui":{"configurationMode":"schema-and-yaml","featured":true,"sections":["persistence","replicas","backups","scheduling","resources"]}}
