{"artifact":{"chart":"grafana","repository":"grafana","type":"helm","version":"10.5.15","versions":[{"appVersion":"12.3.1","artifact":{"digest":"sha256:c08c87969270402e7d5227edb8385af67cc32ee34817bff89773ad02303b5d79","name":"grafana","repository":"grafana","type":"helm-http","version":"10.5.15"},"available":true,"compatibility":{"kubernetes":">=1.31.0 <1.36.0"},"configuration":{"defaultPreset":"upstream","namespace":"astronomer-grafana","presets":[{"description":"Start with the exact chart defaults; configure storage, exposure and secret references for your cluster.","id":"upstream","label":"Upstream defaults","values":{}}],"schema":{"properties":{"admin":{"properties":{"existingSecret":{"default":"","title":"Existing admin Secret","type":"string","x-astronomer-resource":"secrets"}},"type":"object"},"ingress":{"properties":{"enabled":{"default":false,"title":"Enable Ingress","type":"boolean"},"hosts":{"default":["chart-example.local"],"items":{"default":"chart-example.local","type":"string"},"title":"Ingress hosts","type":"array"}},"type":"object"},"persistence":{"properties":{"enabled":{"default":false,"title":"Enable persistence","type":"boolean"},"size":{"default":"10Gi","title":"Volume size","type":"string"},"storageClassName":{"title":"StorageClass","type":"string","x-astronomer-resource":"storageclasses"}},"type":"object"},"replicas":{"default":1,"minimum":0,"type":"integer"},"resources":{"properties":{"limits":{"properties":{"cpu":{"pattern":"^([0-9]+(\\.[0-9]+)?([EPTGMK]i?|m)?|)$","title":"CPU limit","type":"string"},"memory":{"pattern":"^([0-9]+(\\.[0-9]+)?([EPTGMK]i?|m)?|)$","title":"Memory limit","type":"string"}},"title":"Limits","type":"object"},"requests":{"properties":{"cpu":{"pattern":"^([0-9]+(\\.[0-9]+)?([EPTGMK]i?|m)?|)$","title":"CPU request","type":"string"},"memory":{"pattern":"^([0-9]+(\\.[0-9]+)?([EPTGMK]i?|m)?|)$","title":"Memory request","type":"string"}},"title":"Requests","type":"object"}},"title":"Resources","type":"object"}},"type":"object"}},"identities":{"chartDigest":"sha256:c08c87969270402e7d5227edb8385af67cc32ee34817bff89773ad02303b5d79"},"recommended":true,"supportTier":"upstream","version":"10.5.15"}]},"category":"monitoring","compatibility":{"kubernetes":">=1.31.0 <1.36.0"},"defaultEnabled":false,"documentation":"https://github.com/grafana/helm-charts/tree/main/charts/grafana","home":"https://grafana.com/oss/grafana/","icon":"https://cdn.simpleicons.org/grafana/F46800","keywords":["dashboards","visualization"],"lifecycle":{"install":true,"rollback":true,"uninstall":true,"upgrade":true},"name":"Grafana","privileged":false,"resources":{"profile":"medium"},"slug":"grafana","storage":{"recommended":"10Gi","required":true},"summary":"Dashboards and visualization for metrics, logs, and traces.","supportTier":"upstream","ui":{"configurationMode":"schema-and-yaml","featured":true,"sections":["general","authentication","datasources","persistence","resources"]}}
