{"artifact":{"chart":"prometheus-node-exporter","repository":"prometheus-community","type":"helm","version":"4.56.1","versions":[{"appVersion":"1.12.1","artifact":{"digest":"sha256:70fab291e00a34c58fd943bb075fecc2e2e73fa95db1bcbbe7cdfe008795354a","name":"prometheus-node-exporter","repository":"prometheus-community","type":"helm-http","version":"4.56.1"},"available":true,"compatibility":{"kubernetes":">=1.31.0 <1.36.0"},"configuration":{"defaultPreset":"upstream","namespace":"astronomer-monitoring","presets":[{"description":"Start with the exact chart defaults; configure storage, exposure and secret references for your cluster.","id":"upstream","label":"Upstream defaults","values":{}}],"schema":{"properties":{"hostNetwork":{"default":true,"title":"Use host network","type":"boolean"},"hostPID":{"default":true,"title":"Use host PID namespace","type":"boolean"},"hostRootFsMount":{"properties":{"enabled":{"default":true,"title":"Mount host root filesystem","type":"boolean"}},"type":"object"},"prometheus":{"properties":{"monitor":{"properties":{"enabled":{"default":false,"title":"Create ServiceMonitor","type":"boolean"}},"type":"object"}},"type":"object"},"resources":{"properties":{"limits":{"properties":{"cpu":{"pattern":"^([0-9]+(\\.[0-9]+)?([EPTGMK]i?|m)?|)$","title":"CPU limit","type":"string"},"memory":{"pattern":"^([0-9]+(\\.[0-9]+)?([EPTGMK]i?|m)?|)$","title":"Memory limit","type":"string"}},"title":"Limits","type":"object"},"requests":{"properties":{"cpu":{"pattern":"^([0-9]+(\\.[0-9]+)?([EPTGMK]i?|m)?|)$","title":"CPU request","type":"string"},"memory":{"pattern":"^([0-9]+(\\.[0-9]+)?([EPTGMK]i?|m)?|)$","title":"Memory request","type":"string"}},"title":"Requests","type":"object"}},"title":"Resources","type":"object"},"service":{"properties":{"port":{"default":9100,"title":"Metrics port","type":"integer"}},"type":"object"}},"type":"object"}},"identities":{"chartDigest":"sha256:70fab291e00a34c58fd943bb075fecc2e2e73fa95db1bcbbe7cdfe008795354a"},"recommended":true,"supportTier":"experimental","version":"4.56.1"}]},"category":"monitoring","compatibility":{"kubernetes":">=1.31.0 <1.36.0"},"defaultEnabled":true,"documentation":"https://github.com/prometheus-community/helm-charts/tree/main/charts/prometheus-node-exporter","home":"https://github.com/prometheus/node_exporter","icon":"https://cdn.simpleicons.org/prometheus/E6522C","keywords":["nodes","metrics","capacity"],"lifecycle":{"install":true,"rollback":true,"uninstall":true,"upgrade":true},"name":"Prometheus Node Exporter","privileged":true,"resources":{"profile":"small"},"slug":"prometheus-node-exporter","storage":{"required":false},"summary":"Host metrics for node and capacity dashboards.","supportTier":"experimental","ui":{"configurationMode":"schema-and-yaml","featured":true,"sections":["general","collectors","resources","scheduling"]}}
