{"artifact":{"chart":"trivy-operator","repository":"aqua","type":"helm","version":"0.36.0","versions":[{"appVersion":"0.34.0","artifact":{"digest":"sha256:bb0c44bc70e3158cc63ea49d7458ede6db5b6c932f6585a2d787eb9712fd4288","name":"trivy-operator","repository":"aqua","type":"helm-http","version":"0.36.0"},"available":true,"compatibility":{"kubernetes":">=1.31.0 <1.36.0"},"configuration":{"defaultPreset":"upstream","namespace":"astronomer-trivy-system","presets":[{"description":"Start with the exact chart defaults; configure storage, exposure and secret references for your cluster.","id":"upstream","label":"Upstream defaults","values":{}}],"schema":{"properties":{"operator":{"properties":{"configAuditScannerEnabled":{"default":true,"title":"Configuration audit scanner","type":"boolean"},"scanJobTimeout":{"default":"5m","title":"Scan job timeout","type":"string"},"scanJobsConcurrentLimit":{"default":10,"title":"Concurrent scan jobs","type":"integer"},"vulnerabilityScannerEnabled":{"default":true,"title":"Vulnerability scanner","type":"boolean"}},"type":"object"},"resources":{"properties":{"limits":{"properties":{"cpu":{"pattern":"^([0-9]+(\\.[0-9]+)?([EPTGMK]i?|m)?|)$","title":"CPU limit","type":"string"},"memory":{"pattern":"^([0-9]+(\\.[0-9]+)?([EPTGMK]i?|m)?|)$","title":"Memory limit","type":"string"}},"title":"Limits","type":"object"},"requests":{"properties":{"cpu":{"pattern":"^([0-9]+(\\.[0-9]+)?([EPTGMK]i?|m)?|)$","title":"CPU request","type":"string"},"memory":{"pattern":"^([0-9]+(\\.[0-9]+)?([EPTGMK]i?|m)?|)$","title":"Memory request","type":"string"}},"title":"Requests","type":"object"}},"title":"Resources","type":"object"},"serviceMonitor":{"properties":{"enabled":{"default":false,"title":"Create ServiceMonitor","type":"boolean"}},"type":"object"},"trivy":{"properties":{"ignoreUnfixed":{"default":false,"title":"Ignore unfixed vulnerabilities","type":"boolean"},"severity":{"default":"UNKNOWN,LOW,MEDIUM,HIGH,CRITICAL","title":"Reported severities","type":"string"}},"type":"object"}},"type":"object"}},"identities":{"chartDigest":"sha256:bb0c44bc70e3158cc63ea49d7458ede6db5b6c932f6585a2d787eb9712fd4288"},"recommended":true,"supportTier":"upstream","version":"0.36.0"}]},"category":"security","compatibility":{"kubernetes":">=1.31.0 <1.36.0"},"defaultEnabled":false,"documentation":"https://aquasecurity.github.io/trivy-operator/latest/","home":"https://github.com/aquasecurity/trivy-operator","icon":"https://raw.githubusercontent.com/aquasecurity/trivy/main/docs/imgs/logo.png","keywords":["trivy","vulnerability","compliance"],"lifecycle":{"install":true,"rollback":true,"uninstall":true,"upgrade":true},"name":"Trivy Operator","privileged":true,"resources":{"profile":"medium"},"slug":"trivy-operator","storage":{"required":false},"summary":"Kubernetes-native vulnerability and configuration scanning with Trivy.","supportTier":"upstream","ui":{"configurationMode":"schema-and-yaml","featured":true,"sections":["scanners","reports","operator","resources"]}}
