{"artifact":{"chart":"cert-manager","repository":"jetstack","type":"helm","version":"v1.21.1","versions":[{"appVersion":"v1.21.1","artifact":{"digest":"sha256:c27101f3f3e2349fb4a9e704316105bf7b52ad73b8c8257d3498ef7f2f6a4adc","name":"cert-manager","repository":"jetstack","type":"helm-http","version":"v1.21.1"},"available":true,"compatibility":{"kubernetes":">=1.31.0 <1.36.0"},"configuration":{"defaultPreset":"upstream","namespace":"astronomer-cert-manager","presets":[{"description":"Start with the exact chart defaults; configure storage, exposure and secret references for your cluster.","id":"upstream","label":"Upstream defaults","values":{}}],"schema":{"properties":{"cainjector":{"properties":{"replicaCount":{"default":1,"minimum":0,"title":"CA injector replicas","type":"integer"}},"type":"object"},"crds":{"properties":{"enabled":{"default":false,"title":"Install CRDs","type":"boolean"}},"type":"object"},"prometheus":{"properties":{"enabled":{"default":true,"title":"Expose Prometheus metrics","type":"boolean"}},"type":"object"},"replicaCount":{"default":1,"minimum":0,"title":"Controller replicas","type":"integer"},"resources":{"properties":{"limits":{"properties":{"cpu":{"pattern":"^([0-9]+(\\.[0-9]+)?([EPTGMK]i?|m)?|)$","title":"CPU limit","type":"string"},"memory":{"pattern":"^([0-9]+(\\.[0-9]+)?([EPTGMK]i?|m)?|)$","title":"Memory limit","type":"string"}},"title":"Limits","type":"object"},"requests":{"properties":{"cpu":{"pattern":"^([0-9]+(\\.[0-9]+)?([EPTGMK]i?|m)?|)$","title":"CPU request","type":"string"},"memory":{"pattern":"^([0-9]+(\\.[0-9]+)?([EPTGMK]i?|m)?|)$","title":"Memory request","type":"string"}},"title":"Requests","type":"object"}},"title":"Controller resources","type":"object"},"startupapicheck":{"properties":{"enabled":{"default":true,"title":"Run startup API check","type":"boolean"}},"type":"object"},"webhook":{"properties":{"replicaCount":{"default":1,"minimum":0,"title":"Webhook replicas","type":"integer"}},"type":"object"}},"type":"object"}},"identities":{"chartDigest":"sha256:c27101f3f3e2349fb4a9e704316105bf7b52ad73b8c8257d3498ef7f2f6a4adc"},"recommended":true,"supportTier":"upstream","version":"v1.21.1"}]},"category":"security","compatibility":{"kubernetes":">=1.31.0 <1.36.0"},"defaultEnabled":false,"documentation":"https://cert-manager.io/docs/installation/helm/","home":"https://cert-manager.io/","icon":"https://raw.githubusercontent.com/cert-manager/cert-manager/master/logo/logo-small.png","keywords":["tls","certificates","letsencrypt"],"lifecycle":{"install":true,"rollback":true,"uninstall":true,"upgrade":true},"name":"cert-manager","privileged":true,"resources":{"profile":"medium"},"slug":"cert-manager","storage":{"required":false},"summary":"Certificate issuance and renewal for Kubernetes workloads.","supportTier":"upstream","ui":{"configurationMode":"schema-and-yaml","featured":true,"sections":["crds","webhook","approver","resources"]}}
