{"artifact":{"chart":"external-dns","repository":"external-dns","type":"helm","version":"1.21.1","versions":[{"appVersion":"0.21.0","artifact":{"digest":"sha256:5dd033a4b872bf641860695705ee460031d0bc695f114bf8926fee6736814e19","name":"external-dns","repository":"external-dns","type":"helm-http","version":"1.21.1"},"available":true,"compatibility":{"kubernetes":">=1.31.0 <1.36.0"},"configuration":{"defaultPreset":"upstream","namespace":"astronomer-external-dns","presets":[{"description":"Start with the exact chart defaults; configure storage, exposure and secret references for your cluster.","id":"upstream","label":"Upstream defaults","values":{}}],"schema":{"properties":{"domainFilters":{"default":[],"items":{"type":"string"},"title":"Domain filters","type":"array"},"interval":{"default":"1m","title":"Sync interval","type":"string"},"policy":{"default":"upsert-only","title":"Record policy","type":"string"},"provider":{"properties":{"name":{"default":"aws","title":"DNS provider","type":"string"}},"type":"object"},"resources":{"properties":{"limits":{"properties":{"cpu":{"pattern":"^([0-9]+(\\.[0-9]+)?([EPTGMK]i?|m)?|)$","title":"CPU limit","type":"string"},"memory":{"pattern":"^([0-9]+(\\.[0-9]+)?([EPTGMK]i?|m)?|)$","title":"Memory limit","type":"string"}},"title":"Limits","type":"object"},"requests":{"properties":{"cpu":{"pattern":"^([0-9]+(\\.[0-9]+)?([EPTGMK]i?|m)?|)$","title":"CPU request","type":"string"},"memory":{"pattern":"^([0-9]+(\\.[0-9]+)?([EPTGMK]i?|m)?|)$","title":"Memory request","type":"string"}},"title":"Requests","type":"object"}},"title":"Resources","type":"object"},"serviceMonitor":{"properties":{"enabled":{"default":false,"title":"Create ServiceMonitor","type":"boolean"}},"type":"object"},"sources":{"default":["service","ingress"],"items":{"default":"service","type":"string"},"title":"Record sources","type":"array"},"txtOwnerId":{"default":null,"title":"TXT owner ID","type":["string","null"]}},"type":"object"}},"identities":{"chartDigest":"sha256:5dd033a4b872bf641860695705ee460031d0bc695f114bf8926fee6736814e19"},"recommended":true,"supportTier":"upstream","version":"1.21.1"}]},"category":"networking","compatibility":{"kubernetes":">=1.31.0 <1.36.0"},"defaultEnabled":false,"description":"Automate DNS records for exposed Kubernetes workloads using supported public and private DNS providers.","documentation":"https://kubernetes-sigs.github.io/external-dns/latest/docs/","home":"https://kubernetes-sigs.github.io/external-dns/","icon":"https://raw.githubusercontent.com/kubernetes/kubernetes/master/logo/logo.svg","keywords":["dns","route53","cloudflare","azure-dns","google-dns"],"lifecycle":{"install":true,"rollback":true,"uninstall":true,"upgrade":true},"name":"ExternalDNS","privileged":true,"resources":{"profile":"small"},"slug":"external-dns","storage":{"required":false},"summary":"Synchronize Kubernetes Services and routes with DNS providers.","supportTier":"upstream","ui":{"configurationMode":"schema-and-yaml","featured":true,"sections":["provider","sources","domain-filters","policy","resources"]}}
