{"artifact":{"chart":"loki","repository":"grafana","type":"helm","version":"7.3.0","versions":[{"appVersion":"3.6.12","artifact":{"digest":"sha256:04a339f712d770a1f599f05fc0a5a3cde18e43914e49ae6a49f7171be86bcc09","name":"loki","repository":"grafana","type":"helm-http","version":"7.3.0"},"available":true,"compatibility":{"kubernetes":">=1.31.0 <1.36.0"},"configuration":{"defaultPreset":"evaluation","namespace":"astronomer-loki","presets":[{"description":"Ephemeral filesystem storage on one replica. Logs are lost when the pod is replaced. For evaluation only.","id":"evaluation","label":"Single replica evaluation","values":{"backend":{"replicas":0},"chunksCache":{"enabled":false},"deploymentMode":"SingleBinary","loki":{"auth_enabled":false,"commonConfig":{"replication_factor":1},"schemaConfig":{"configs":[{"from":"2024-04-01","index":{"period":"24h","prefix":"loki_index_"},"object_store":"filesystem","schema":"v13","store":"tsdb"}]},"storage":{"type":"filesystem"}},"read":{"replicas":0},"resultsCache":{"enabled":false},"singleBinary":{"persistence":{"enabled":false},"replicas":1},"write":{"replicas":0}}},{"description":"One replica with a 50Gi persistent volume. Select a StorageClass and review capacity and retention. This configuration is not highly available.","id":"persistent","label":"Persistent single replica","values":{"backend":{"replicas":0},"chunksCache":{"enabled":false},"deploymentMode":"SingleBinary","loki":{"auth_enabled":false,"commonConfig":{"replication_factor":1},"schemaConfig":{"configs":[{"from":"2024-04-01","index":{"period":"24h","prefix":"loki_index_"},"object_store":"filesystem","schema":"v13","store":"tsdb"}]},"storage":{"type":"filesystem"}},"read":{"replicas":0},"resultsCache":{"enabled":false},"singleBinary":{"persistence":{"enabled":true,"size":"50Gi"},"replicas":1},"write":{"replicas":0}}}],"schema":{"properties":{"backend":{"properties":{"replicas":{"minimum":0,"title":"Backend replicas","type":"integer"}},"title":"Backend workloads","type":"object","x-astronomer-advanced":true},"deploymentMode":{"default":"SimpleScalable","enum":["SingleBinary","SimpleScalable","Distributed"],"title":"Deployment mode","type":"string"},"gateway":{"properties":{"enabled":{"default":true,"title":"Enable gateway","type":"boolean"}},"title":"Gateway","type":"object"},"loki":{"properties":{"auth_enabled":{"default":true,"title":"Enable tenant authentication","type":"boolean"},"commonConfig":{"properties":{"replication_factor":{"minimum":1,"title":"Replication factor","type":"integer"}},"type":"object"},"storage":{"properties":{"bucketNames":{"properties":{"admin":{"title":"Admin bucket","type":"string"},"chunks":{"title":"Chunks bucket","type":"string"},"ruler":{"title":"Ruler bucket","type":"string"}},"type":"object","x-astronomer-show-when":{"equals":"s3","path":"loki.storage.type"}},"type":{"default":"s3","enum":["filesystem","s3","gcs","azure","swift","alibabacloud","bos","cos"],"title":"Storage type","type":"string"}},"type":"object"}},"title":"Storage and authentication","type":"object"},"monitoring":{"properties":{"serviceMonitor":{"properties":{"enabled":{"default":false,"title":"Create ServiceMonitor","type":"boolean"}},"type":"object"}},"title":"Metrics integration","type":"object"},"read":{"properties":{"replicas":{"minimum":0,"title":"Read replicas","type":"integer"}},"title":"Read workloads","type":"object","x-astronomer-advanced":true},"singleBinary":{"properties":{"persistence":{"properties":{"enabled":{"default":true,"title":"Retain logs on a persistent volume","type":"boolean"},"size":{"default":"10Gi","pattern":"^[1-9][0-9]*(Mi|Gi|Ti)$","title":"Volume size","type":"string"},"storageClass":{"description":"Leave empty to use the cluster default StorageClass.","title":"StorageClass","type":["string","null"],"x-astronomer-resource":"storageclasses"}},"title":"Log storage","type":"object"},"replicas":{"default":0,"minimum":0,"title":"Single binary replicas","type":"integer"}},"title":"Single replica","type":"object","x-astronomer-show-when":{"equals":"SingleBinary","path":"deploymentMode"}},"write":{"properties":{"replicas":{"minimum":0,"title":"Write replicas","type":"integer"}},"title":"Write workloads","type":"object","x-astronomer-advanced":true}},"type":"object"}},"identities":{"chartDigest":"sha256:04a339f712d770a1f599f05fc0a5a3cde18e43914e49ae6a49f7171be86bcc09"},"recommended":true,"supportTier":"experimental","version":"7.3.0"}]},"category":"logging","compatibility":{"kubernetes":">=1.31.0 <1.36.0"},"defaultEnabled":false,"documentation":"https://grafana.com/docs/loki/latest/setup/install/helm/","home":"https://grafana.com/oss/loki/","icon":"https://cdn.simpleicons.org/grafana/F46800","keywords":["logs","observability"],"lifecycle":{"install":true,"rollback":false,"uninstall":true,"upgrade":true},"name":"Loki","privileged":false,"resources":{"profile":"large"},"slug":"loki","storage":{"recommended":"100Gi","required":true},"summary":"Horizontally scalable log aggregation from Grafana Labs.","supportTier":"experimental","ui":{"configurationMode":"schema-and-yaml","featured":true,"sections":["deployment-mode","storage","retention","gateway","resources"]}}
