{"artifact":{"chart":"kyverno","repository":"kyverno","type":"helm","version":"3.9.0","versions":[{"appVersion":"v1.19.0","artifact":{"digest":"sha256:9663e8d3d15b070e5925b4f26b3f9a8824872a42ac7bf27ca105c897cb5aba51","name":"kyverno","repository":"kyverno","type":"helm-http","version":"3.9.0"},"available":true,"compatibility":{"kubernetes":">=1.31.0 <1.36.0"},"configuration":{"defaultPreset":"upstream","namespace":"astronomer-kyverno","presets":[{"description":"Start with the exact chart defaults; configure storage, exposure and secret references for your cluster.","id":"upstream","label":"Upstream defaults","values":{}}],"schema":{"properties":{"admissionController":{"properties":{"replicas":{"default":null,"title":"Admission controller replicas","type":["string","null"]},"serviceMonitor":{"properties":{"enabled":{"default":false,"title":"Create ServiceMonitor","type":"boolean"}},"type":"object"}},"type":"object"},"backgroundController":{"properties":{"replicas":{"default":null,"title":"Background controller replicas","type":["string","null"]}},"type":"object"},"cleanupController":{"properties":{"replicas":{"default":null,"title":"Cleanup controller replicas","type":["string","null"]}},"type":"object"},"features":{"properties":{"policyReports":{"properties":{"enabled":{"default":true,"title":"Policy reports","type":"boolean"}},"type":"object"}},"type":"object"},"reportsController":{"properties":{"replicas":{"default":null,"title":"Reports controller replicas","type":["string","null"]}},"type":"object"}},"type":"object"}},"identities":{"chartDigest":"sha256:9663e8d3d15b070e5925b4f26b3f9a8824872a42ac7bf27ca105c897cb5aba51"},"recommended":true,"supportTier":"upstream","version":"3.9.0"}]},"category":"security","compatibility":{"kubernetes":">=1.31.0 <1.36.0"},"defaultEnabled":false,"description":"Validate, mutate, generate, clean up, and verify Kubernetes resources using declarative policies.","documentation":"https://kyverno.io/docs/installation/methods/","home":"https://kyverno.io/","icon":"https://raw.githubusercontent.com/kyverno/kyverno/main/img/logo.png","keywords":["policy","admission","supply-chain","compliance"],"lifecycle":{"install":true,"rollback":true,"uninstall":true,"upgrade":true},"name":"Kyverno","privileged":true,"resources":{"profile":"medium"},"slug":"kyverno","storage":{"required":false},"summary":"Kubernetes-native policy management and image verification.","supportTier":"upstream","ui":{"configurationMode":"schema-and-yaml","featured":true,"sections":["admission","background","cleanup","reports","resources"]}}
